{
  "schema_version": "0.1.0",
  "clinical_value_claim_id": "clinical_value_claim_ambience_source_planning_v0",
  "source_class": "external_competitor_claim",
  "readiness_state": "planning_only",
  "production_ready": false,
  "customer_facing_claim": false,
  "patient_care_action": false,
  "statement": "External source claims describe clinical documentation, coding, workflow integration, revenue integrity, and risk reduction benefits. These are captured as competitor/source claims only.",
  "value_domains": [
    "documentation_burden",
    "coding_accuracy",
    "revenue_integrity",
    "audit_defensibility",
    "clinician_productivity",
    "workflow_integration",
    "risk_reduction"
  ],
  "metric_claims": [
    {
      "metric": "charting_time_reduction",
      "value": "source_claim_only",
      "source": "Ambience Healthcare source packet",
      "validated_by_socioprophet": false
    }
  ],
  "evidence_refs": [
    "source:ambience-healthcare-pdf",
    "source:healthbench-openai-pdf"
  ],
  "blocked_from": [
    "production_ready",
    "customer_facing_claim",
    "patient_care_action",
    "autonomous_clinical_action"
  ],
  "created_at": "2026-06-05T00:00:00Z"
}
